repo_full_name,repo_url,policy_files,candidate_count,evidence_group_count,best_candidate_score,matched_ai_terms,matched_policy_terms,has_restrictive_language,evidence_blocks,commit_shas,first_processed_at,last_processed_at,manual_label,manual_notes
obsproject/obs-studio,https://github.com/obsproject/obs-studio.git,CONTRIBUTING.md,1,1,4,AI tools,policy,false,"Group 1 | File: CONTRIBUTING.md | Lines: 119 | Heading: AI/Machine Learning Policy | AI terms: AI tools | Policy terms: policy | Best score: 4 | Has restrictive term: false | Paragraphs: 1. [line 119] Because of the above concerns, we have opted to take the following policy towards submissions with regard to the use of these AI tools:",a13632c0d903dcb7d96a3ae3eb37a8069686e13a,2026-05-22T15:24:39.773394Z,2026-05-22T15:24:39.773394Z,,
ohmyzsh/ohmyzsh,https://github.com/ohmyzsh/ohmyzsh.git,.github/PULL_REQUEST_TEMPLATE.md && CONTRIBUTING.md,6,3,5,AI tools; AI-assisted; AI-generated,PR; contribution; Submitting; Pull Requests; contributions; disclosure; should; PRs,true,"Group 1 | File: .github/PULL_REQUEST_TEMPLATE.md | Lines: 10 | Heading: Standards checklist: | AI terms: AI tools | Policy terms: PR; contribution | Best score: 3 | Has restrictive term: false | Paragraphs: 1. [line 10] - [ ] The PR title is descriptive. - [ ] The PR doesn't replicate another PR which is already open. - [ ] I have read the contribution guide and followed all the instructions. - [ ] The code follows the code style guide detailed in the wiki. - [ ] The code is mine or it's from somewhere with an MIT-compatible license. - [ ] If I used AI tools (ChatGPT, Claude, Gemini, etc.) to assist with this contribution, I've disclosed it below. - [ ] The code is efficient, to the best of my ability, and does not waste computer resources. - [ ] The code is stable and I have tested it myself, to the best of my abilities. - [ ] If the code introduces new aliases, I provide a valid use case for all plugin users down below. ### Group 2 | File: CONTRIBUTING.md | Lines: 19 | Heading: CONTRIBUTING GUIDELINES | AI terms: AI-assisted | Policy terms: Submitting; Pull Requests; contributions | Best score: 4 | Has restrictive term: false | Paragraphs: 1. [line 19] - [Reporting Issues](#reporting-issues) - [You have a problem](#you-have-a-problem) - [You have a suggestion](#you-have-a-suggestion) - [Submitting Pull Requests](#submitting-pull-requests) - [Getting started](#getting-started) - [You have a solution](#you-have-a-solution) - [You have an addition](#you-have-an-addition) - [A note on AI-assisted contributions](#a-note-on-ai-assisted-contributions) - [Use the Search, Luke](#use-the-search-luke) - [Commit Guidelines](#commit-guidelines) - [Format](#format) - [Style](#style) - [Volunteer](#volunteer) ### Group 3 | File: CONTRIBUTING.md | Lines: 129, 135, 141, 147 | Heading: A note on AI-assisted contributions | AI terms: AI-assisted; AI tools; AI-generated | Policy terms: contributions; contribution; PR; disclosure; should; PRs | Best score: 5 | Has restrictive term: true | Paragraphs: 1. [line 129] ## A note on AI-assisted contributions || 2. [line 135] If you used AI tools meaningfully in your contribution (code generation, agentic coding assistants, etc.), please mention it in your PR description. Basic autocomplete doesn't count, but if an AI wrote substantial parts of your code, just let us know. || 3. [line 141] **Examples of good disclosure:** - ""Used ChatGPT to help generate the initial regex pattern for parsing git status output"" - ""Claude assisted with writing the unit tests for this feature"" - ""Generated with Gemini and then reviewed/tested manually"" - Or simply: ""AI-assisted"" in your PR description || 4. [line 147] - **You understand your code**: You should be able to explain what your contribution does and how it works. We want to collaborate with humans who are invested in the project. - **Context matters**: Tell us what problem you're solving, how you tested it, and link to relevant docs. Small, incremental changes work better than massive generated overhauls. - **Quality over quantity**: We'd rather have one thoughtful, well-tested contribution than ten AI-generated PRs that need extensive review.",cb64103161b69d59e1efefeb761ac85564c44698,2026-05-22T15:19:31.494515Z,2026-05-22T15:19:31.494515Z,,
onyx-dot-app/onyx,https://github.com/onyx-dot-app/onyx.git,CONTRIBUTING.md,1,1,4,LLM,should,true,"Group 1 | File: CONTRIBUTING.md | Lines: 283 | Heading: Wrapping up | AI terms: LLM | Policy terms: should | Best score: 4 | Has restrictive term: true | Paragraphs: 1. [line 283] Now, visit http://localhost:3000 in your browser. You should see the Onyx onboarding wizard where you can connect your external LLM provider to Onyx.",599442f35ab32238656402367e74d03855523907,2026-05-22T15:50:16.589168Z,2026-05-22T15:50:16.589168Z,,
openclaw/openclaw,https://github.com/openclaw/openclaw.git,CONTRIBUTING.md,4,3,4,AI-assisted; LLM; AI-generated,PRs; PR; must,true,"Group 1 | File: CONTRIBUTING.md | Lines: 147 | Heading: Review Conversations Are Author-Owned | AI terms: AI-assisted | Policy terms: PRs | Best score: 3 | Has restrictive term: false | Paragraphs: 1. [line 147] This applies to both human-authored and AI-assisted PRs. ### Group 2 | File: CONTRIBUTING.md | Lines: 170, 177 | Heading: AI/Vibe-Coded PRs Welcome! 🤖 | AI terms: AI-assisted; LLM | Policy terms: PR; PRs | Best score: 3 | Has restrictive term: false | Paragraphs: 1. [line 170] - [ ] Mark as AI-assisted in the PR title or description - [ ] Include human-run real behavior proof from your own setup. AI-generated tests, mocks, lint, typechecks, and CI output are supplemental only; they do not prove the fix works for users. - [ ] Include prompts or session logs if possible (super helpful!) - [ ] Confirm you understand what the code does - [ ] If you have access to Codex, run `codex review --base origin/main` locally and address the findings before asking for review - [ ] Resolve or reply to bot review conversations after you address them || 2. [line 177] AI PRs are first-class citizens here. We just want transparency so reviewers know what to look for. If you are using an LLM coding agent, instruct it to resolve bot review conversations it has addressed instead of leaving them for maintainers. ### Group 3 | File: CONTRIBUTING.md | Lines: 237 | Heading: Required in Reports | AI terms: AI-generated | Policy terms: must | Best score: 4 | Has restrictive term: true | Paragraphs: 1. [line 237] Reports without reproduction steps, demonstrated impact, and remediation advice will be deprioritized. Given the volume of AI-generated scanner findings, we must ensure we're receiving vetted reports from researchers who understand the issues.",8fc48af09190bc4222cca77f5d7d62b665a45db7,2026-05-22T15:19:22.977271Z,2026-05-22T15:19:22.977271Z,,
OWASP/CheatSheetSeries,https://github.com/OWASP/CheatSheetSeries.git,.github/pull_request_template.md && CONTRIBUTING.md,3,2,5,AI Tool; generative AI,Disclosure; required; PRs; PR; pull requests; must; pull request; contribution,true,"Group 1 | File: .github/pull_request_template.md | Lines: 28, 32 | Heading: AI Tool Usage Disclosure (required for all PRs) | AI terms: AI Tool | Policy terms: Disclosure; required; PRs; PR | Best score: 5 | Has restrictive term: true | Paragraphs: 1. [line 28] ## AI Tool Usage Disclosure (required for all PRs) || 2. [line 32] - [ ] I have NOT used any AI tool to generate the contents of this PR. - [ ] I have used AI tools to generate the contents of this PR. I have verified the contents and I affirm the results. The LLM used is `[llm name and version]` and the prompt used is `[your prompt here]`. I have independently verified every citation and technical claim against the cited source. [Feel free to add more details if needed] ### Group 2 | File: CONTRIBUTING.md | Lines: 141 | Heading: Use of AI | AI terms: generative AI | Policy terms: pull requests; must; pull request; contribution | Best score: 4 | Has restrictive term: true | Paragraphs: 1. [line 141] Depending on the prompts used, generative AI can produce content that is generalised and verbose; therefore review all output carefully before considering it for issues, pull requests, comments and discussions. If it is genuinely helpful to use generative AI then it **must** be declared in any pull request, failure to do so can result in the contribution being closed or deleted.",4e1e63fe13e49fd564fb4e9aa0ed90721ead2445,2026-05-22T15:48:10.639741Z,2026-05-22T15:48:10.639741Z,,
paperclipai/paperclip,https://github.com/paperclipai/paperclip.git,CONTRIBUTING.md,1,1,2,LLM,pull request,false,"Group 1 | File: CONTRIBUTING.md | Lines: 84 | Heading: Thinking Path Example 1: | AI terms: LLM | Policy terms: pull request | Best score: 2 | Has restrictive term: false | Paragraphs: 1. [line 84] > - Paperclip orchestrates ai-agents for zero-human companies > - There are many types of adapters for each LLM model provider > - But LLM's have a context limit and not all agents can automatically compact their context > - So we need to have an adapter-specific configuration for which adapters can and cannot automatically compact their context > - This pull request adds per-adapter configuration of compaction, either auto or paperclip managed > - That way we can get optimal performance from any adapter/provider in Paperclip",90117827eba34104ca1a4cefcc4acae7214a9f40,2026-05-22T15:25:51.506978Z,2026-05-22T15:25:51.506978Z,,
paperless-ngx/paperless-ngx,https://github.com/paperless-ngx/paperless-ngx.git,.github/PULL_REQUEST_TEMPLATE.md && CONTRIBUTING.md,2,2,3,AI tools; AI-generated,PR,false,"Group 1 | File: .github/PULL_REQUEST_TEMPLATE.md | Lines: 39 | Heading: Checklist: | AI terms: AI tools | Policy terms: PR | Best score: 3 | Has restrictive term: false | Paragraphs: 1. [line 39] - [ ] I have read & agree with the [contributing guidelines](https://github.com/paperless-ngx/paperless-ngx/blob/main/CONTRIBUTING.md). - [ ] If applicable, I have included testing coverage for new code in this PR, for [backend](https://docs.paperless-ngx.com/development/#testing) and / or [front-end](https://docs.paperless-ngx.com/development/#testing-and-code-style) changes. - [ ] If applicable, I have tested my code for breaking changes & regressions on both mobile & desktop devices, using the latest version of major browsers. - [ ] If applicable, I have checked that all tests pass, see [documentation](https://docs.paperless-ngx.com/development/#back-end-development). - [ ] I have run all Git `pre-commit` hooks, see [documentation](https://docs.paperless-ngx.com/development/#code-formatting-with-pre-commit-hooks). - [ ] I have made corresponding changes to the documentation as needed. - [ ] In the description of the PR above I have disclosed the use of AI tools in the coding of this PR. ### Group 2 | File: CONTRIBUTING.md | Lines: 69 | Heading: AI-Generated Code | AI terms: AI-generated | Policy terms: PR | Best score: 3 | Has restrictive term: false | Paragraphs: 1. [line 69] This project does not specifically prohibit the use of AI-generated code _during the process_ of creating a PR, however:",6cd5784bd79a130c7a57c0149d3ffe3b012e1873,2026-05-22T15:30:36.895491Z,2026-05-22T15:30:36.895491Z,,
pathwaycom/llm-app,https://github.com/pathwaycom/llm-app.git,CONTRIBUTING.md,1,1,3,llm,contributions,false,"Group 1 | File: CONTRIBUTING.md | Lines: 8 | Heading: The basics: | AI terms: llm | Policy terms: contributions | Best score: 3 | Has restrictive term: false | Paragraphs: 1. [line 8] ## The basics: * Use the [Issue Tracker](https://github.com/pathwaycom/llm-app/issues) to report bugs, crashes, performance issues, etc... Please include as much detail as possible.",5fa97b75a177f11fb68cb6ed2da3c0d16f14d9c0,2026-05-22T15:25:44.013206Z,2026-05-22T15:25:44.013206Z,,
photoprism/photoprism,https://github.com/photoprism/photoprism.git,CONTRIBUTING.md,1,1,4,AI tools,pull requests; contribution; must; contributor,true,"Group 1 | File: CONTRIBUTING.md | Lines: 46 | Heading: Submitting Pull Requests ## | AI terms: AI tools | Policy terms: pull requests; contribution; must; contributor | Best score: 4 | Has restrictive term: true | Paragraphs: 1. [line 46] You are welcome to use AI tools for research, drafting, or other supporting tasks. However, we do not accept fully AI-generated pull requests at this time. Every contribution must be carefully reviewed, tested, and understood by a human contributor who can discuss the implementation details and maintain the change afterward.",c6428da76143c9496d98d0d451220c186b3fa806,2026-05-22T15:30:47.079552Z,2026-05-22T15:30:47.079552Z,,
php/php-src,https://github.com/php/php-src.git,CONTRIBUTING.md,1,1,3,LLM,Pull requests; submitting; contribution,false,Group 1 | File: CONTRIBUTING.md | Lines: 23 | Heading: Index | AI terms: LLM | Policy terms: Pull requests; submitting; contribution | Best score: 3 | Has restrictive term: false | Paragraphs: 1. [line 23] * [Pull requests](#pull-requests) * [Filing bugs](#filing-bugs) * [Feature requests](#feature-requests) * [Technical resources](#technical-resources) * [Writing tests](#writing-tests) * [Writing documentation](#writing-documentation) * [Getting help](#getting-help) * [PHP source code directory structure](#php-source-code-directory-structure) * [PHP internals](#php-internals) * [PECL extensions](#pecl-extensions) * [Checklist for submitting contribution](#checklist-for-submitting-contribution) * [What happens after submitting contribution?](#what-happens-after-submitting-contribution) * [What happens when your contribution is applied?](#what-happens-when-your-contribution-is-applied) * [Git commit rules](#git-commit-rules) * [Copyright and license headers](#copyright-and-license-headers) * [NEWS file](#news) * [LLM usage in GitHub comments](#llm-usage-in-github-comments),c4105b6243e8c0ae6882e847414df5930ac45ac7,2026-05-22T15:30:35.930765Z,2026-05-22T15:30:35.930765Z,,
pocketbase/pocketbase,https://github.com/pocketbase/pocketbase.git,CONTRIBUTING.md,1,1,4,LLM,PRs; PR; contributions,false,"Group 1 | File: CONTRIBUTING.md | Lines: 4 | Heading: Contributing to PocketBase | AI terms: LLM | Policy terms: PRs; PR; contributions | Best score: 4 | Has restrictive term: false | Paragraphs: 1. [line 4] > [!IMPORTANT] > Due to recent LLM spam, PRs are temporary disabled and only existing collaborators can open a PR. > If you stumble on a problem that you want to fix, please consider instead opening an issue or discussion with link to your fork _(if not obvious - LLM contributions are not welcome)_. > This status may change in the future in case GitHub finally decide to do something about the constant spam, or when I find time to move the project somewhere else.",3616b9d66769dcda95841c52b00c166246323333,2026-05-22T15:26:04.412615Z,2026-05-22T15:26:04.412615Z,,
PostHog/posthog,https://github.com/PostHog/posthog.git,CONTRIBUTING.md,1,1,4,AI contributions,submitting; contribution; contributions; policy; disclosure; submit,true,"Group 1 | File: CONTRIBUTING.md | Lines: 28 | Heading: External PRs: what to expect | AI terms: AI contributions | Policy terms: submitting; contribution; contributions; policy; disclosure; submit | Best score: 4 | Has restrictive term: true | Paragraphs: 1. [line 28] - Ensure that you've run tests locally and resolved any merge conflicts before submitting. - Respond to automated review feedback (e.g. Greptile comments) where applicable. - Keep the change focused; add tests and docs where it meaningfully improves clarity. - Follow existing patterns and conventions in the areas you touch. - If AI helped write your contribution, read our [AI contributions policy](AI_POLICY.md) - we expect disclosure and full understanding of the code you submit.",286ab91822d7043b38b02fbb33ee6a874b1e55c0,2026-05-22T15:46:31.503531Z,2026-05-22T15:46:31.503531Z,,
pytorch/pytorch,https://github.com/pytorch/pytorch.git,CONTRIBUTING.md,2,2,4,AI-Assisted; AI-generated,PRs; contributions; must; contributor; should; PR,true,"Group 1 | File: CONTRIBUTING.md | Lines: 15 | Heading: Table of Contents | AI terms: AI-Assisted | Policy terms: PRs | Best score: 3 | Has restrictive term: false | Paragraphs: 1. [line 15] - [Developing PyTorch](#developing-pytorch) - [Tips and Debugging](#tips-and-debugging) - [Nightly Checkout & Pull](#nightly-checkout--pull) - [Codebase structure](#codebase-structure) - [AI-Assisted Development](#ai-assisted-development) - [Spin](#spin) - [Building](#building) - [Linting](#linting) - [default lint](#default-lint) - [Regenerating](#regenerating) - [Unit testing](#unit-testing) - [Python Unit Testing](#python-unit-testing) - [Better local unit tests with `pytest`](#better-local-unit-tests-with-pytest) - [Local linting](#local-linting) - [Running `pyrefly`](#running-pyrefly) - [C++ Unit Testing](#c-unit-testing) - [Run Specific CI Jobs](#run-specific-ci-jobs) - [Merging your Change](#merging-your-change) - [Writing documentation](#writing-documentation) - [Docstring type formatting](#docstring-type-formatting) - [Building documentation](#building-documentation) - [Tips](#tips) - [Building C++ Documentation](#building-c-documentation) - [Previewing changes locally](#previewing-changes-locally) - [Previewing documentation on PRs](#previewing-documentation-on-prs) - [Adding documentation tests](#adding-documentation-tests) - [Profiling with `py-spy`](#profiling-with-py-spy) - [Managing multiple build trees](#managing-multiple-build-trees) - [C++ development tips](#c-development-tips) - [Build only what you need](#build-only-what-you-need) - [Code completion and IDE support](#code-completion-and-ide-support) - [Make no-op build fast](#make-no-op-build-fast) - [Use Ninja](#use-ninja) - [Use CCache](#use-ccache) - [Use a faster linker](#use-a-faster-linker) - [Use pre-compiled headers](#use-pre-compiled-headers) - [Workaround for header dependency bug in nvcc](#workaround-for-header-dependency-bug-in-nvcc) - [Rebuild few files with debug information](#rebuild-few-files-with-debug-information) - [C++ frontend development tips](#c-frontend-development-tips) - [GDB integration](#gdb-integration) - [C++ stacktraces](#c-stacktraces) - [CUDA development tips](#cuda-development-tips) - [Windows development tips](#windows-development-tips) - [Known MSVC (and MSVC with NVCC) bugs](#known-msvc-and-msvc-with-nvcc-bugs) - [Building on legacy code and CUDA](#building-on-legacy-code-and-cuda) - [Pre-commit tidy/linting hook](#pre-commit-tidylinting-hook) - [Building PyTorch with ASAN](#building-pytorch-with-asan) - [Getting `ccache` to work](#getting-ccache-to-work) - [Why this stuff with `LD_PRELOAD` and `LIBASAN_RT`?](#why-this-stuff-with-ld_preload-and-libasan_rt) - [Why LD_PRELOAD in the build function?](#why-ld_preload-in-the-build-function) - [Why no leak detection?](#why-no-leak-detection) - [Caffe2 notes](#caffe2-notes) - [CI failure tips](#ci-failure-tips) - [Which commit is used in CI?](#which-commit-is-used-in-ci) - [Dev Infra Office Hours](#dev-infra-office-hours) ### Group 2 | File: CONTRIBUTING.md | Lines: 295 | Heading: AI-Assisted Development | AI terms: AI-generated | Policy terms: PRs; contributions; must; contributor; should; PR | Best score: 4 | Has restrictive term: true | Paragraphs: 1. [line 295] - **You are personally responsible for what you send**: If the comments, issues or PRs you send are low quality or consistently overly verbose compared to what is expected, your contributions will not be accepted anymore. You are responsible for reviewing, ensuring the accuracy and the quality of everything you send. - **PRs must have an associated ""actionable"" Issue**: Generally, as a new contributor, you should never send a PR that doesn't have a corresponding issue with the ""actionable"" label. If you just opened the issue, you must wait for a maintainer to review it and mark it actionable before preparing and sending a PR for it. - **New features, utility functions, or core extensions**: Create a short and to the point issue about the problem you're encountering. You should NEVER include AI-generated explanation of how to solve the problem (this will be discussed later once it's decided the feature should be implemented).",7abbfda0cb1931e9da61d85024480115f74aeb43,2026-05-22T15:21:46.668613Z,2026-05-22T15:21:46.668613Z,,
qdrant/qdrant,https://github.com/qdrant/qdrant.git,docs/CONTRIBUTING.md,5,4,5,AI tools; AI-generated,contributions; require; PR; Disclose,true,"Group 1 | File: docs/CONTRIBUTING.md | Lines: 55 | Heading: Contributing with AI | AI terms: AI tools | Policy terms: contributions; require | Best score: 5 | Has restrictive term: true | Paragraphs: 1. [line 55] At Qdrant, we recognize the usefulness of AI tools in software development. At the same time, we also observe the growing problem of a high volume of contributions, which require careful reviews. ### Group 2 | File: docs/CONTRIBUTING.md | Lines: 63 | Heading: Do not communicate with real people through AI | AI terms: AI tools | Policy terms: PR | Best score: 3 | Has restrictive term: false | Paragraphs: 1. [line 63] When preparing a PR description or answering to comments, please avoid using AI tools to generate the content. We want to see PR documentation as a source of truth, so we can validate if the changes are actually following the intent. Avoid including AI-generated diagrams or walkthroughs of the code; if somebody would like to read them, they can always generate them themselves. ### Group 3 | File: docs/CONTRIBUTING.md | Lines: 67 | Heading: If you are using AI tools to generate PR, you are still responsible for the results | AI terms: AI tools | Policy terms: PR | Best score: 3 | Has restrictive term: false | Paragraphs: 1. [line 67] #### If you are using AI tools to generate PR, you are still responsible for the results ### Group 4 | File: docs/CONTRIBUTING.md | Lines: 72, 76 | Heading: Disclose if some parts of the PR are generated with AI tools | AI terms: AI tools; AI-generated | Policy terms: Disclose; PR | Best score: 4 | Has restrictive term: true | Paragraphs: 1. [line 72] #### Disclose if some parts of the PR are generated with AI tools || 2. [line 76] For example, a good PR description with AI-generated commits:",e01c207f40a2fe01ed23a191957a76e224fe5726,2026-05-22T15:48:44.949664Z,2026-05-22T15:48:44.949664Z,,
rapid7/metasploit-framework,https://github.com/rapid7/metasploit-framework.git,CONTRIBUTING.md,2,2,4,LLM,PR; should; contributor; contributors; submitting; pull request; submit; PRs,true,"Group 1 | File: CONTRIBUTING.md | Lines: 28 | Heading: Vibecoding, AI, and LLM | AI terms: LLM | Policy terms: PR; should | Best score: 4 | Has restrictive term: true | Paragraphs: 1. [line 28] ## Vibecoding, AI, and LLM My first job had a token ring LAN and I still own a Win98SE CD, so I'm not entirely sure what _vibecoding_ is, but we're cool with any coding technique you use to create a PR as long as it is tested, documented, and does what it says it does. Untested code is incomplete code, and incomplete code should be marked as a draft PR or WIP (Work in Progress) until it is complete, tested, and ready for a committer to review. We have had several submissions clearly from AI that were well-formatted, looked really neat, and did nothing it said it did. While we have no problem with AI-assisted coding, please do not assume that the code generated by an AI or LLM is logically or even syntactically correct. ### Group 2 | File: CONTRIBUTING.md | Lines: 53 | Heading: <u>Pull Requests</u> | AI terms: LLM | Policy terms: contributor; contributors; PR; submitting; pull request; submit; PRs | Best score: 3 | Has restrictive term: false | Paragraphs: 1. [line 53] * **Do** create a [topic branch] to work on instead of working directly on `master`. This helps to: * Protect the process. * Ensures users are aware of commits on the branch being considered for merge. * Allows for a location for more commits to be offered without mingling with other contributor changes. * Allows contributors to make progress while a PR is still being reviewed. * **Do** follow the [50/72 rule] for Git commit messages. * **Do** write ""WIP"" on your PR and/or open a [draft PR] if submitting **working** yet unfinished code. * **Do** target your pull request to the **master branch**. * **Do** specify a descriptive title to make searching for your pull request easier. * **Do** include [console output], especially for effects that can be witnessed in the `msfconsole`. * **Do** test your code and submit the test output in your PR with any sensitive information removed. * **Do** list [verification steps] so committers can test your code. * **Do** [reference associated issues] in your pull request description. * **Don't** leave your pull request description blank. * **Don't** include sensitive information in your PR (including externally-routable IP addresses in documentation). * **Don't** PR untested/unvalidated code you copy/pasted from the internet. * **Don't** PR untested/unvalidated code you copy/pasted from AI or LLM. * **Don't** abandon your pull request. Being responsive helps us land your code faster. * **Don't** post questions in older closed PRs.",ba71087220535af939015eb01a78463196f02fb3,2026-05-22T15:31:11.209810Z,2026-05-22T15:31:11.209810Z,,
